"product_id";"sku";"category";"sub_category";"product_name";"brand"
505;"OFF-AR-10001545";"Office Supplies";"Art";"Newell 326";"Newell"
506;"OFF-AR-10001547";"Office Supplies";"Art";"Newell 311";"Newell"
507;"OFF-AR-10001573";"Office Supplies";"Art";"American Pencil";"American"
508;"OFF-AR-10001615";"Office Supplies";"Art";"Newell 34";"Newell"
509;"OFF-AR-10001662";"Office Supplies";"Art";"Rogers Handheld Barrel Pencil Sharpener";"Rogers"
510;"OFF-AR-10001683";"Office Supplies";"Art";"Lumber Crayons";"Lumber"
511;"OFF-AR-10001725";"Office Supplies";"Art";"Boston Home & Office Model 2000 Electric Pencil Sharpeners";"Boston"
512;"OFF-AR-10001761";"Office Supplies";"Art";"Avery Hi-Liter Smear-Safe Highlighters";"Avery"
513;"OFF-AR-10001770";"Office Supplies";"Art";"Economy #2 Pencils";"Economy"
514;"OFF-AR-10001860";"Office Supplies";"Art";"BIC Liqua Brite Liner";"BIC"
515;"OFF-AR-10001868";"Office Supplies";"Art";"Prang Dustless Chalk Sticks";"Prang"
516;"OFF-AR-10001897";"Office Supplies";"Art";"Model L Table or Wall-Mount Pencil Sharpener";"Model"
517;"OFF-AR-10001915";"Office Supplies";"Art";"Peel-Off China Markers";"Peel-Off"
518;"OFF-AR-10001919";"Office Supplies";"Art";"OIC #2 Pencils, Medium Soft";"OIC"
519;"OFF-AR-10001940";"Office Supplies";"Art";"Sanford Colorific Eraseable Coloring Pencils, 12 Count";"Sanford"
520;"OFF-AR-10001953";"Office Supplies";"Art";"Boston 1645 Deluxe Heavier-Duty Electric Pencil Sharpener";"Boston"
521;"OFF-AR-10001954";"Office Supplies";"Art";"Newell 331";"Newell"
522;"OFF-AR-10001955";"Office Supplies";"Art";"Newell 319";"Newell"
523;"OFF-AR-10001958";"Office Supplies";"Art";"Stanley Bostitch Contemporary Electric Pencil Sharpeners";"Stanley"
524;"OFF-AR-10001972";"Office Supplies";"Art";"Newell 323";"Newell"
525;"OFF-AR-10001988";"Office Supplies";"Art";"Bulldog Table or Wall-Mount Pencil Sharpener";"Bulldog"
526;"OFF-AR-10002053";"Office Supplies";"Art";"Premium Writing Pencils, Soft, #2 by Central Association for the Blind";"Premium"
527;"OFF-AR-10002067";"Office Supplies";"Art";"Newell 334";"Newell"
528;"OFF-AR-10002135";"Office Supplies";"Art";"Boston Heavy-Duty Trimline Electric Pencil Sharpeners";"Boston"
529;"OFF-AR-10002221";"Office Supplies";"Art";"12 Colored Short Pencils";"12"
530;"OFF-AR-10002240";"Office Supplies";"Art";"Panasonic KP-150 Electric Pencil Sharpener";"Panasonic"
531;"OFF-AR-10002255";"Office Supplies";"Art";"Newell 346";"Newell"
532;"OFF-AR-10002257";"Office Supplies";"Art";"Eldon Spacemaker Box, Quick-Snap Lid, Clear";"Eldon"
533;"OFF-AR-10002280";"Office Supplies";"Art";"Staples in misc. colors";"Staples"
534;"OFF-AR-10002335";"Office Supplies";"Art";"DIXON Oriole Pencils";"DIXON"
535;"OFF-AR-10002375";"Office Supplies";"Art";"Newell 351";"Newell"
536;"OFF-AR-10002399";"Office Supplies";"Art";"Dixon Prang Watercolor Pencils, 10-Color Set with Brush";"Dixon"
537;"OFF-AR-10002445";"Office Supplies";"Art";"SANFORD Major Accent Highlighters";"SANFORD"
538;"OFF-AR-10002467";"Office Supplies";"Art";"Dixon Ticonderoga Pencils";"Dixon"
539;"OFF-AR-10002578";"Office Supplies";"Art";"Newell 335";"Newell"
540;"OFF-AR-10002656";"Office Supplies";"Art";"Sanford Liquid Accent Highlighters";"Sanford"
541;"OFF-AR-10002766";"Office Supplies";"Art";"Prang Drawing Pencil Set";"Prang"
542;"OFF-AR-10002804";"Office Supplies";"Art";"Faber Castell Col-Erase Pencils";"Faber"
543;"OFF-AR-10002818";"Office Supplies";"Art";"Panasonic KP-310 Heavy-Duty Electric Pencil Sharpener";"Panasonic"
544;"OFF-AR-10002833";"Office Supplies";"Art";"Newell 322";"Newell"
545;"OFF-AR-10002956";"Office Supplies";"Art";"Boston 16801 Nautilus Battery Pencil Sharpener";"Boston"
546;"OFF-AR-10002987";"Office Supplies";"Art";"Prismacolor Color Pencil Set";"Prismacolor"
547;"OFF-AR-10003045";"Office Supplies";"Art";"Prang Colored Pencils";"Prang"
548;"OFF-AR-10003056";"Office Supplies";"Art";"Newell 341";"Newell"
549;"OFF-AR-10003087";"Office Supplies";"Art";"Staples in misc. colors";"Staples"
550;"OFF-AR-10003156";"Office Supplies";"Art";"50 Colored Long Pencils";"50"
551;"OFF-AR-10003158";"Office Supplies";"Art";"Fluorescent Highlighters by Dixon";"Fluorescent"
552;"OFF-AR-10003179";"Office Supplies";"Art";"Dixon Ticonderoga Core-Lock Colored Pencils";"Dixon"
553;"OFF-AR-10003183";"Office Supplies";"Art";"Avery Fluorescent Highlighter Four-Color Set";"Avery"
554;"OFF-AR-10003190";"Office Supplies";"Art";"Newell 32";"Newell"
555;"OFF-AR-10003217";"Office Supplies";"Art";"Newell 316";"Newell"
556;"OFF-AR-10003251";"Office Supplies";"Art";"Prang Drawing Pencil Set";"Prang"
557;"OFF-AR-10003338";"Office Supplies";"Art";"Eberhard Faber 3 1/2"" Golf Pencils";"Eberhard"
558;"OFF-AR-10003373";"Office Supplies";"Art";"Boston School Pro Electric Pencil Sharpener, 1670";"Boston"
559;"OFF-AR-10003394";"Office Supplies";"Art";"Newell 332";"Newell"
560;"OFF-AR-10003405";"Office Supplies";"Art";"Dixon My First Ticonderoga Pencil, #2";"Dixon"
561;"OFF-AR-10003469";"Office Supplies";"Art";"Nontoxic Chalk";"Nontoxic"
562;"OFF-AR-10003477";"Office Supplies";"Art";"4009 Highlighters";"4009"
563;"OFF-AR-10003478";"Office Supplies";"Art";"Avery Hi-Liter EverBold Pen Style Fluorescent Highlighters, 4/Pack";"Avery"
564;"OFF-AR-10003481";"Office Supplies";"Art";"Newell 348";"Newell"
565;"OFF-AR-10003504";"Office Supplies";"Art";"Newell 347";"Newell"
566;"OFF-AR-10003514";"Office Supplies";"Art";"4009 Highlighters by Sanford";"4009"
567;"OFF-AR-10003560";"Office Supplies";"Art";"Zebra Zazzle Fluorescent Highlighters";"Zebra"
568;"OFF-AR-10003582";"Office Supplies";"Art";"Boston Electric Pencil Sharpener, Model 1818, Charcoal Black";"Boston"
569;"OFF-AR-10003602";"Office Supplies";"Art";"Quartet Omega Colored Chalk, 12/Pack";"Quartet"
570;"OFF-AR-10003631";"Office Supplies";"Art";"Staples in misc. colors";"Staples"
571;"OFF-AR-10003651";"Office Supplies";"Art";"Newell 350";"Newell"
572;"OFF-AR-10003696";"Office Supplies";"Art";"Panasonic KP-350BK Electric Pencil Sharpener with Auto Stop";"Panasonic"
573;"OFF-AR-10003727";"Office Supplies";"Art";"Berol Giant Pencil Sharpener";"Berol"
574;"OFF-AR-10003732";"Office Supplies";"Art";"Newell 333";"Newell"
575;"OFF-AR-10003752";"Office Supplies";"Art";"Deluxe Chalkboard Eraser Cleaner";"Deluxe"
576;"OFF-AR-10003759";"Office Supplies";"Art";"Crayola Anti Dust Chalk, 12/Pack";"Crayola"
577;"OFF-AR-10003770";"Office Supplies";"Art";"Newell 340";"Newell"
578;"OFF-AR-10003772";"Office Supplies";"Art";"Boston 16750 Black Compact Battery Pencil Sharpener";"Boston"
579;"OFF-AR-10003811";"Office Supplies";"Art";"Newell 327";"Newell"
580;"OFF-AR-10003829";"Office Supplies";"Art";"Newell 35";"Newell"
581;"OFF-AR-10003856";"Office Supplies";"Art";"Newell 344";"Newell"
582;"OFF-AR-10003876";"Office Supplies";"Art";"Avery Hi-Liter GlideStik Fluorescent Highlighter, Yellow Ink";"Avery"
583;"OFF-AR-10003896";"Office Supplies";"Art";"Stride Job 150 Highlighters, Chisel Tip, Assorted Colors";"Stride"
584;"OFF-AR-10003903";"Office Supplies";"Art";"Sanford 52201 APSCO Electric Pencil Sharpener";"Sanford"
585;"OFF-AR-10003958";"Office Supplies";"Art";"Newell 337";"Newell"
586;"OFF-AR-10003986";"Office Supplies";"Art";"Avery Hi-Liter Pen Style Six-Color Fluorescent Set";"Avery"
587;"OFF-AR-10004010";"Office Supplies";"Art";"Hunt Boston Vacuum Mount KS Pencil Sharpener";"Hunt"
588;"OFF-AR-10004022";"Office Supplies";"Art";"Panasonic KP-380BK Classic Electric Pencil Sharpener";"Panasonic"
589;"OFF-AR-10004027";"Office Supplies";"Art";"Binney & Smith inkTank Erasable Desk Highlighter, Chisel Tip, Yellow, 12/Box";"Binney"
590;"OFF-AR-10004042";"Office Supplies";"Art";"BOSTON Model 1800 Electric Pencil Sharpeners, Putty/Woodgrain";"BOSTON"
591;"OFF-AR-10004062";"Office Supplies";"Art";"Staples in misc. colors";"Staples"
592;"OFF-AR-10004078";"Office Supplies";"Art";"Newell 312";"Newell"
593;"OFF-AR-10004165";"Office Supplies";"Art";"Binney & Smith inkTank Erasable Pocket Highlighter, Chisel Tip, Yellow";"Binney"
594;"OFF-AR-10004260";"Office Supplies";"Art";"Boston 1799 Powerhouse Electric Pencil Sharpener";"Boston"
595;"OFF-AR-10004269";"Office Supplies";"Art";"Newell 31";"Newell"
596;"OFF-AR-10004344";"Office Supplies";"Art";"Bulldog Vacuum Base Pencil Sharpener";"Bulldog"
597;"OFF-AR-10004441";"Office Supplies";"Art";"BIC Brite Liner Highlighters";"BIC"
598;"OFF-AR-10004456";"Office Supplies";"Art";"Panasonic KP-4ABK Battery-Operated Pencil Sharpener";"Panasonic"
599;"OFF-AR-10004582";"Office Supplies";"Art";"BIC Brite Liner Grip Highlighters";"BIC"
600;"OFF-AR-10004587";"Office Supplies";"Art";"Boston 1827 Commercial Additional Cutter, Drive Gear & Gear Rack for 1606";"Boston"
601;"OFF-AR-10004602";"Office Supplies";"Art";"Boston KS Multi-Size Manual Pencil Sharpener";"Boston"
602;"OFF-AR-10004648";"Office Supplies";"Art";"Boston 19500 Mighty Mite Electric Pencil Sharpener";"Boston"
603;"OFF-AR-10004685";"Office Supplies";"Art";"Binney & Smith Crayola Metallic Colored Pencils, 8-Color Set";"Binney"
604;"OFF-AR-10004691";"Office Supplies";"Art";"Boston 1730 StandUp Electric Pencil Sharpener";"Boston"
605;"OFF-AR-10004707";"Office Supplies";"Art";"Staples in misc. colors";"Staples"
606;"OFF-AR-10004752";"Office Supplies";"Art";"Blackstonian Pencils";"Blackstonian"
607;"OFF-AR-10004757";"Office Supplies";"Art";"Crayola Colored Pencils";"Crayola"
608;"OFF-AR-10004790";"Office Supplies";"Art";"Staples in misc. colors";"Staples"
609;"OFF-AR-10004817";"Office Supplies";"Art";"Colorific Watercolor Pencils";"Colorific"
610;"OFF-AR-10004930";"Office Supplies";"Art";"Turquoise Lead Holder with Pocket Clip";"Turquoise"
611;"OFF-AR-10004956";"Office Supplies";"Art";"Newell 33";"Newell"
612;"OFF-AR-10004974";"Office Supplies";"Art";"Newell 342";"Newell"
613;"OFF-AR-10004999";"Office Supplies";"Art";"Newell 315";"Newell"
614;"OFF-BI-10000014";"Office Supplies";"Binders";"Heavy-Duty E-Z-D Binders";"Heavy-Duty"
615;"OFF-BI-10000042";"Office Supplies";"Binders";"Pressboard Data Binder, Crimson, 12"" X 8 1/2""";"Pressboard"
616;"OFF-BI-10000050";"Office Supplies";"Binders";"Angle-D Binders with Locking Rings, Label Holders";"Angle-D"
617;"OFF-BI-10000069";"Office Supplies";"Binders";"GBC Prepunched Paper, 19-Hole, for Binding Systems, 24-lb";"GBC"
618;"OFF-BI-10000088";"Office Supplies";"Binders";"GBC Imprintable Covers";"GBC"
619;"OFF-BI-10000138";"Office Supplies";"Binders";"Acco Translucent Poly Ring Binders";"Acco"
620;"OFF-BI-10000145";"Office Supplies";"Binders";"Zipper Ring Binder Pockets";"Zipper"
621;"OFF-BI-10000174";"Office Supplies";"Binders";"Wilson Jones Clip & Carry Folder Binder Tool for Ring Binders, Clear";"Wilson"
622;"OFF-BI-10000201";"Office Supplies";"Binders";"Avery Triangle Shaped Sheet Lifters, Black, 2/Pack";"Avery"
623;"OFF-BI-10000216";"Office Supplies";"Binders";"Mead 1st Gear 2"" Zipper Binder, Asst. Colors";"Mead"
624;"OFF-BI-10000279";"Office Supplies";"Binders";"Acco Recycled 2"" Capacity Laser Printer Hanging Data Binders";"Acco"
625;"OFF-BI-10000285";"Office Supplies";"Binders";"XtraLife ClearVue Slant-D Ring Binders by Cardinal";"XtraLife"
626;"OFF-BI-10000301";"Office Supplies";"Binders";"GBC Instant Report Kit";"GBC"
627;"OFF-BI-10000309";"Office Supplies";"Binders";"GBC Twin Loop Wire Binding Elements, 9/16"" Spine, Black";"GBC"
628;"OFF-BI-10000315";"Office Supplies";"Binders";"Poly Designer Cover & Back";"Poly"
629;"OFF-BI-10000320";"Office Supplies";"Binders";"GBC Plastic Binding Combs";"GBC"
630;"OFF-BI-10000343";"Office Supplies";"Binders";"Pressboard Covers with Storage Hooks, 9 1/2"" x 11"", Light Blue";"Pressboard"
631;"OFF-BI-10000404";"Office Supplies";"Binders";"Avery Printable Repositionable Plastic Tabs";"Avery"
632;"OFF-BI-10000474";"Office Supplies";"Binders";"Avery Recycled Flexi-View Covers for Binding Systems";"Avery"
633;"OFF-BI-10000494";"Office Supplies";"Binders";"Acco Economy Flexible Poly Round Ring Binder";"Acco"
634;"OFF-BI-10000545";"Office Supplies";"Binders";"GBC Ibimaster 500 Manual ProClick Binding System";"GBC"
635;"OFF-BI-10000546";"Office Supplies";"Binders";"Avery Durable Binders";"Avery"
636;"OFF-BI-10000591";"Office Supplies";"Binders";"Avery Binder Labels";"Avery"
637;"OFF-BI-10000605";"Office Supplies";"Binders";"Acco Pressboard Covers with Storage Hooks, 9 1/2"" x 11"", Executive Red";"Acco"
638;"OFF-BI-10000632";"Office Supplies";"Binders";"Satellite Sectional Post Binders";"Satellite"
639;"OFF-BI-10000666";"Office Supplies";"Binders";"Surelock Post Binders";"Surelock"
640;"OFF-BI-10000756";"Office Supplies";"Binders";"Storex DuraTech Recycled Plastic Frosted Binders";"Storex"
641;"OFF-BI-10000773";"Office Supplies";"Binders";"Insertable Tab Post Binder Dividers";"Insertable"
642;"OFF-BI-10000778";"Office Supplies";"Binders";"GBC VeloBinder Electric Binding Machine";"GBC"
643;"OFF-BI-10000822";"Office Supplies";"Binders";"Acco PRESSTEX Data Binder with Storage Hooks, Light Blue, 9 1/2"" X 11""";"Acco"
644;"OFF-BI-10000829";"Office Supplies";"Binders";"Avery Non-Stick Binders";"Avery"
645;"OFF-BI-10000831";"Office Supplies";"Binders";"Storex Flexible Poly Binders with Double Pockets";"Storex"
646;"OFF-BI-10000848";"Office Supplies";"Binders";"Angle-D Ring Binders";"Angle-D"
647;"OFF-BI-10000948";"Office Supplies";"Binders";"GBC Laser Imprintable Binding System Covers, Desert Sand";"GBC"
648;"OFF-BI-10000962";"Office Supplies";"Binders";"Acco Flexible ACCOHIDE Square Ring Data Binder, Dark Blue, 11 1/2"" X 14"" 7/8""";"Acco"
649;"OFF-BI-10000977";"Office Supplies";"Binders";"Ibico Plastic Spiral Binding Combs";"Ibico"
650;"OFF-BI-10001031";"Office Supplies";"Binders";"Pressboard Data Binders by Wilson Jones";"Pressboard"
651;"OFF-BI-10001036";"Office Supplies";"Binders";"Cardinal EasyOpen D-Ring Binders";"Cardinal"
652;"OFF-BI-10001071";"Office Supplies";"Binders";"GBC ProClick Punch Binding System";"GBC"
653;"OFF-BI-10001072";"Office Supplies";"Binders";"GBC Clear Cover, 8-1/2 x 11, unpunched, 25 covers per pack";"GBC"
654;"OFF-BI-10001078";"Office Supplies";"Binders";"Acco PRESSTEX Data Binder with Storage Hooks, Dark Blue, 14 7/8"" X 11""";"Acco"
655;"OFF-BI-10001097";"Office Supplies";"Binders";"Avery Hole Reinforcements";"Avery"
656;"OFF-BI-10001098";"Office Supplies";"Binders";"Acco D-Ring Binder w/DublLock";"Acco"
657;"OFF-BI-10001107";"Office Supplies";"Binders";"GBC White Gloss Covers, Plain Front";"GBC"
658;"OFF-BI-10001116";"Office Supplies";"Binders";"Wilson Jones 1"" Hanging DublLock Ring Binders";"Wilson"
659;"OFF-BI-10001120";"Office Supplies";"Binders";"Ibico EPK-21 Electric Binding System";"Ibico"
660;"OFF-BI-10001132";"Office Supplies";"Binders";"Acco PRESSTEX Data Binder with Storage Hooks, Dark Blue, 9 1/2"" X 11""";"Acco"
661;"OFF-BI-10001153";"Office Supplies";"Binders";"Ibico Recycled Grain-Textured Covers";"Ibico"
662;"OFF-BI-10001191";"Office Supplies";"Binders";"Canvas Sectional Post Binders";"Canvas"
663;"OFF-BI-10001196";"Office Supplies";"Binders";"Avery Flip-Chart Easel Binder, Black";"Avery"
664;"OFF-BI-10001249";"Office Supplies";"Binders";"Avery Heavy-Duty EZD View Binder with Locking Rings";"Avery"
665;"OFF-BI-10001267";"Office Supplies";"Binders";"Universal Recycled Hanging Pressboard Report Binders, Letter Size";"Universal"
666;"OFF-BI-10001294";"Office Supplies";"Binders";"Fellowes Binding Cases";"Fellowes"
667;"OFF-BI-10001308";"Office Supplies";"Binders";"GBC Standard Plastic Binding Systems' Combs";"GBC"
668;"OFF-BI-10001359";"Office Supplies";"Binders";"GBC DocuBind TL300 Electric Binding System";"GBC"
669;"OFF-BI-10001460";"Office Supplies";"Binders";"Plastic Binding Combs";"Plastic"
670;"OFF-BI-10001510";"Office Supplies";"Binders";"Deluxe Heavy-Duty Vinyl Round Ring Binder";"Deluxe"
671;"OFF-BI-10001524";"Office Supplies";"Binders";"GBC Premium Transparent Covers with Diagonal Lined Pattern";"GBC"
672;"OFF-BI-10001525";"Office Supplies";"Binders";"Acco Pressboard Covers with Storage Hooks, 14 7/8"" x 11"", Executive Red";"Acco"
673;"OFF-BI-10001543";"Office Supplies";"Binders";"GBC VeloBinder Manual Binding System";"GBC"
674;"OFF-BI-10001553";"Office Supplies";"Binders";"SpineVue Locking Slant-D Ring Binders by Cardinal";"SpineVue"
675;"OFF-BI-10001575";"Office Supplies";"Binders";"GBC Linen Binding Covers";"GBC"
676;"OFF-BI-10001597";"Office Supplies";"Binders";"Wilson Jones Ledger-Size, Piano-Hinge Binder, 2"", Blue";"Wilson"
677;"OFF-BI-10001617";"Office Supplies";"Binders";"GBC Wire Binding Combs";"GBC"
678;"OFF-BI-10001628";"Office Supplies";"Binders";"Acco Data Flex Cable Posts For Top & Bottom Load Binders, 6"" Capacity";"Acco"
679;"OFF-BI-10001634";"Office Supplies";"Binders";"Wilson Jones Active Use Binders";"Wilson"
680;"OFF-BI-10001636";"Office Supplies";"Binders";"Ibico Plastic and Wire Spiral Binding Combs";"Ibico"
681;"OFF-BI-10001658";"Office Supplies";"Binders";"GBC Standard Therm-A-Bind Covers";"GBC"
682;"OFF-BI-10001670";"Office Supplies";"Binders";"Vinyl Sectional Post Binders";"Vinyl"
683;"OFF-BI-10001679";"Office Supplies";"Binders";"GBC Instant Index System for Binding Systems";"GBC"
684;"OFF-BI-10001718";"Office Supplies";"Binders";"GBC DocuBind P50 Personal Binding Machine";"GBC"
685;"OFF-BI-10001721";"Office Supplies";"Binders";"Trimflex Flexible Post Binders";"Trimflex"
686;"OFF-BI-10001757";"Office Supplies";"Binders";"Pressboard Hanging Data Binders for Unburst Sheets";"Pressboard"
687;"OFF-BI-10001759";"Office Supplies";"Binders";"Acco Pressboard Covers with Storage Hooks, 14 7/8"" x 11"", Dark Blue";"Acco"
688;"OFF-BI-10001765";"Office Supplies";"Binders";"Wilson Jones Heavy-Duty Casebound Ring Binders with Metal Hinges";"Wilson"
689;"OFF-BI-10001787";"Office Supplies";"Binders";"Wilson Jones Four-Pocket Poly Binders";"Wilson"
690;"OFF-BI-10001890";"Office Supplies";"Binders";"Avery Poly Binder Pockets";"Avery"
691;"OFF-BI-10001900";"Office Supplies";"Binders";"DXL Angle-View Binders with Locking Rings, Black";"DXL"
692;"OFF-BI-10001922";"Office Supplies";"Binders";"Storex Dura Pro Binders";"Storex"
693;"OFF-BI-10001982";"Office Supplies";"Binders";"Wilson Jones Custom Binder Spines & Labels";"Wilson"
694;"OFF-BI-10001989";"Office Supplies";"Binders";"Premium Transparent Presentation Covers by GBC";"Premium"
695;"OFF-BI-10002003";"Office Supplies";"Binders";"Ibico Presentation Index for Binding Systems";"Ibico"
696;"OFF-BI-10002012";"Office Supplies";"Binders";"Wilson Jones Easy Flow II Sheet Lifters";"Wilson"
697;"OFF-BI-10002026";"Office Supplies";"Binders";"Ibico Recycled Linen-Style Covers";"Ibico"
698;"OFF-BI-10002026";"Office Supplies";"Binders";"Avery Arch Ring Binders";"Avery"
699;"OFF-BI-10002049";"Office Supplies";"Binders";"UniKeep View Case Binders";"UniKeep"
700;"OFF-BI-10002071";"Office Supplies";"Binders";"Fellowes Black Plastic Comb Bindings";"Fellowes"
701;"OFF-BI-10002072";"Office Supplies";"Binders";"Cardinal Slant-D Ring Binders";"Cardinal"
702;"OFF-BI-10002082";"Office Supplies";"Binders";"GBC Twin Loop Wire Binding Elements";"GBC"
703;"OFF-BI-10002103";"Office Supplies";"Binders";"Cardinal Slant-D Ring Binder, Heavy Gauge Vinyl";"Cardinal"
704;"OFF-BI-10002133";"Office Supplies";"Binders";"Wilson Jones Elliptical Ring 3 1/2"" Capacity Binders, 800 sheets";"Wilson"
705;"OFF-BI-10002160";"Office Supplies";"Binders";"Acco Hanging Data Binders";"Acco"
706;"OFF-BI-10002194";"Office Supplies";"Binders";"Cardinal Hold-It CD Pocket";"Cardinal"
707;"OFF-BI-10002215";"Office Supplies";"Binders";"Wilson Jones Hanging View Binder, White, 1""";"Wilson"
708;"OFF-BI-10002225";"Office Supplies";"Binders";"Square Ring Data Binders, Rigid 75 Pt. Covers, 11"" x 14-7/8""";"Square"
709;"OFF-BI-10002309";"Office Supplies";"Binders";"Avery Heavy-Duty EZD  Binder With Locking Rings";"Avery"
710;"OFF-BI-10002353";"Office Supplies";"Binders";"GBC VeloBind Cover Sets";"GBC"
711;"OFF-BI-10002393";"Office Supplies";"Binders";"Binder Posts";"Binder"
712;"OFF-BI-10002412";"Office Supplies";"Binders";"Wilson Jones “Snap” Scratch Pad Binder Tool for Ring Binders";"Wilson"
713;"OFF-BI-10002414";"Office Supplies";"Binders";"GBC ProClick Spines for 32-Hole Punch";"GBC"
714;"OFF-BI-10002429";"Office Supplies";"Binders";"Premier Elliptical Ring Binder, Black";"Premier"
715;"OFF-BI-10002432";"Office Supplies";"Binders";"Wilson Jones Standard D-Ring Binders";"Wilson"
716;"OFF-BI-10002437";"Office Supplies";"Binders";"Recycled Premium Regency Composition Covers";"Recycled"
717;"OFF-BI-10002498";"Office Supplies";"Binders";"Clear Mylar Reinforcing Strips";"Clear"
718;"OFF-BI-10002557";"Office Supplies";"Binders";"Presstex Flexible Ring Binders";"Presstex"
719;"OFF-BI-10002571";"Office Supplies";"Binders";"Avery Framed View Binder, EZD Ring (Locking), Navy, 1 1/2""";"Avery"
720;"OFF-BI-10002609";"Office Supplies";"Binders";"Avery Hidden Tab Dividers for Binding Systems";"Avery"
721;"OFF-BI-10002706";"Office Supplies";"Binders";"Avery Premier Heavy-Duty Binder with Round Locking Rings";"Avery"
722;"OFF-BI-10002735";"Office Supplies";"Binders";"GBC Prestige Therm-A-Bind Covers";"GBC"
723;"OFF-BI-10002764";"Office Supplies";"Binders";"Recycled Pressboard Report Cover with Reinforced Top Hinge";"Recycled"
724;"OFF-BI-10002794";"Office Supplies";"Binders";"Avery Trapezoid Ring Binder, 3"" Capacity, Black, 1040 sheets";"Avery"
725;"OFF-BI-10002799";"Office Supplies";"Binders";"SlimView Poly Binder, 3/8""";"SlimView"
726;"OFF-BI-10002813";"Office Supplies";"Binders";"Avery Reinforcements for Hole-Punch Pages";"Avery"
727;"OFF-BI-10002824";"Office Supplies";"Binders";"Recycled Easel Ring Binders";"Recycled"
728;"OFF-BI-10002827";"Office Supplies";"Binders";"Avery Durable Poly Binders";"Avery"
729;"OFF-BI-10002852";"Office Supplies";"Binders";"Ibico Standard Transparent Covers";"Ibico"
730;"OFF-BI-10002854";"Office Supplies";"Binders";"Performers Binder/Pad Holder, Black";"Performers"
731;"OFF-BI-10002867";"Office Supplies";"Binders";"GBC Recycled Regency Composition Covers";"GBC"
732;"OFF-BI-10002897";"Office Supplies";"Binders";"Black Avery Memo-Size 3-Ring Binder, 5 1/2"" x 8 1/2""";"Black"
733;"OFF-BI-10002931";"Office Supplies";"Binders";"Avery Trapezoid Extra Heavy Duty 4"" Binders";"Avery"
734;"OFF-BI-10002949";"Office Supplies";"Binders";"Prestige Round Ring Binders";"Prestige"
735;"OFF-BI-10002954";"Office Supplies";"Binders";"Newell 3-Hole Punched Plastic Slotted Magazine Holders for Binders";"Newell"
736;"OFF-BI-10002976";"Office Supplies";"Binders";"ACCOHIDE Binder by Acco";"ACCOHIDE"
737;"OFF-BI-10002982";"Office Supplies";"Binders";"Avery Self-Adhesive Photo Pockets for Polaroid Photos";"Avery"
738;"OFF-BI-10003007";"Office Supplies";"Binders";"Premium Transparent Presentation Covers, No Pattern/Clear, 8 1/2"" x 11""";"Premium"
739;"OFF-BI-10003091";"Office Supplies";"Binders";"GBC DocuBind TL200 Manual Binding Machine";"GBC"
740;"OFF-BI-10003094";"Office Supplies";"Binders";"Self-Adhesive Ring Binder Labels";"Self-Adhesive"
741;"OFF-BI-10003166";"Office Supplies";"Binders";"GBC Plasticlear Binding Covers";"GBC"
742;"OFF-BI-10003196";"Office Supplies";"Binders";"Accohide Poly Flexible Ring Binders";"Accohide"
743;"OFF-BI-10003274";"Office Supplies";"Binders";"Avery Durable Slant Ring Binders, No Labels";"Avery"
744;"OFF-BI-10003291";"Office Supplies";"Binders";"Wilson Jones Leather-Like Binders with DublLock Round Rings";"Wilson"
745;"OFF-BI-10003305";"Office Supplies";"Binders";"Avery Hanging File Binders";"Avery"
746;"OFF-BI-10003314";"Office Supplies";"Binders";"Tuff Stuff Recycled Round Ring Binders";"Tuff"
747;"OFF-BI-10003350";"Office Supplies";"Binders";"Acco Expandable Hanging Binders";"Acco"
748;"OFF-BI-10003355";"Office Supplies";"Binders";"Cardinal Holdit Business Card Pockets";"Cardinal"
749;"OFF-BI-10003364";"Office Supplies";"Binders";"Binding Machine Supplies";"Binding"
750;"OFF-BI-10003429";"Office Supplies";"Binders";"Cardinal HOLDit! Binder Insert Strips,Extra Strips";"Cardinal"
751;"OFF-BI-10003460";"Office Supplies";"Binders";"Acco 3-Hole Punch";"Acco"
752;"OFF-BI-10003476";"Office Supplies";"Binders";"Avery Metallic Poly Binders";"Avery"
753;"OFF-BI-10003527";"Office Supplies";"Binders";"Fellowes PB500 Electric Punch Plastic Comb Binding Machine with Manual Bind";"Fellowes"
754;"OFF-BI-10003529";"Office Supplies";"Binders";"Avery Round Ring Poly Binders";"Avery"
755;"OFF-BI-10003638";"Office Supplies";"Binders";"GBC Durable Plastic Covers";"GBC"
756;"OFF-BI-10003650";"Office Supplies";"Binders";"GBC DocuBind 300 Electric Binding Machine";"GBC"
757;"OFF-BI-10003655";"Office Supplies";"Binders";"Durable Pressboard Binders";"Durable"
758;"OFF-BI-10003656";"Office Supplies";"Binders";"Fellowes PB200 Plastic Comb Binding Machine";"Fellowes"
759;"OFF-BI-10003669";"Office Supplies";"Binders";"3M Organizer Strips";"3M"
760;"OFF-BI-10003676";"Office Supplies";"Binders";"GBC Standard Recycled Report Covers, Clear Plastic Sheets";"GBC"
761;"OFF-BI-10003684";"Office Supplies";"Binders";"Wilson Jones Legal Size Ring Binders";"Wilson"
762;"OFF-BI-10003694";"Office Supplies";"Binders";"Avery 3 1/2"" Diskette Storage Pages, 10/Pack";"Avery"
763;"OFF-BI-10003707";"Office Supplies";"Binders";"Aluminum Screw Posts";"Aluminum"
764;"OFF-BI-10003708";"Office Supplies";"Binders";"Acco Four Pocket Poly Ring Binder with Label Holder, Smoke, 1""";"Acco"
765;"OFF-BI-10003712";"Office Supplies";"Binders";"Acco Pressboard Covers with Storage Hooks, 14 7/8"" x 11"", Light Blue";"Acco"
766;"OFF-BI-10003718";"Office Supplies";"Binders";"GBC Therma-A-Bind 250T Electric Binding System";"GBC"
767;"OFF-BI-10003719";"Office Supplies";"Binders";"Large Capacity Hanging Post Binders";"Large"
768;"OFF-BI-10003727";"Office Supplies";"Binders";"Avery Durable Slant Ring Binders With Label Holder";"Avery"
769;"OFF-BI-10003784";"Office Supplies";"Binders";"Computer Printout Index Tabs";"Computer"
770;"OFF-BI-10003876";"Office Supplies";"Binders";"Green Canvas Binder for 8-1/2"" x 14"" Sheets";"Green"
